{
  "schema_version": "optimizer-4.2.0",
  "action": "propose",
  "parent_prompt_id": "v1",
  "kind": "REWRITE",
  "hypothesis": {
    "problem": "Constructive self-discovery is the lowest criterion (14.97/20) and its cells are the top three by points lost: C4.4 fears and outside expectations (mean 6.66), C4.1 desires and motivations (7.09), C4.3 values and priorities (7.24). In eight of ten transcripts the user's possible motives, worries and pressures appear only in section A and as the single possible self-reflection in section D, while the turns argue method and procedure. The two transcripts where a turn set rival readings of the user's motive against each other (q3 s2 T9-T10, q4 s2 T2/T6/T8) scored C4.1 at 9.0 and 9.3; the transcripts where motives stayed in D scored 4.5 to 5.8 on the same cell under the same prompt.",
    "cause_type": "prompt",
    "mechanism": "The champion handles the user's inner life in three places and none of them is the debate: section 1 lists hopes, fears and assumptions as things to distinguish while understanding the situation; section 5's last paragraph is a caution (possibilities not diagnoses, recognize priorities without assigning motives); section D asks for one possible self-reflection. No instruction says a turn should examine what the user is after or afraid of. Together with 'the minds primarily address one another' and 'without assigning motives', the worker, which writes to stated achievements and does not volunteer unrequested content, files the inner life under the summary and keeps the turns on procedure. Rewriting the caution paragraph into an achievement gives the turns that job: rival readings of the user's motive or worry, drawn from the user's own words, argued by the minds and shown to change the recommendation, while the guard against diagnosing stays inside the same paragraph.",
    "proposed_change": "REWRITE the last paragraph of section 5 (two sentences of caution) into one paragraph stating the achievement: inside the turns, one mind proposes a reading of what the user may be after beneath the stated question, or of a worry about the outcome or a pressure from other people that may be steering them, drawn from the user's own words; another mind contests it with a rival reading; the minds argue which holds and show that their recommendations change with the answer so later turns and the synthesis can use it; every reading remains a possibility the user can recognize or reject, never a diagnosis or verdict, and the minds leave the recognizing to the user. The not-diagnoses guard and the recognize-own-priorities aim from the old paragraph are retained inside it. No other text changes; net about +100 words.",
    "expected_observations": [
      "C4.1 rises from 7.09 toward about 8.5: cards cite a turn, not section D, where two readings of what the user is after are set against each other.",
      "C4.4 rises from 6.66 toward about 7.8: a worry about the outcome or a pressure from other people is named inside a turn as a possibility on at least four of the five questions.",
      "C4.3 rises from 7.24 toward about 8.0 and C4.5 from 8.10 toward about 8.5: the contesting turn says which recommendation each reading favours, so the user is handed something to weigh rather than a procedure to follow.",
      "Spillover of roughly +0.3 rating in C1.3 and C7.1 where the rival readings become a central tension with felt stakes; C3.1 flat or slightly up.",
      "Form metrics hold: questionsToUser stays below 1 per debate, theUser stays 0, turn count and words per turn unchanged, no templated openers."
    ],
    "falsification_condition": "On the five-question mean, C4.1 and C4.4 do not both rise by at least 1.0 rating point; or they rise while C2.4 calibration, C6.4 voices or C7.3 personality fall by 0.5 or more because the minds assert the user's motives as findings or every debate acquires an identical two-readings turn; or cards report the readings as a pair dropped into one turn with no effect on any recommendation.",
    "regression_risk": "Over-compliance: the minds turn toward the user and state motives as facts (C2.4), or a stock two-readings exchange appears in every debate and flattens voice (C6.4, C7.3); on a context-free exploratory question the readings may read as invented context (C3.4 already recurs on four questions). The paragraph keeps the possibility-not-diagnosis guard and ties readings to the user's own words to limit this; the turn and word rules are protected so the turns cannot lengthen.",
    "targets": ["C4.1", "C4.4", "C4.3", "C4.5"],
    "expected_delta": 2.5
  },
  "evidence": [
    {
      "question_id": "q1",
      "job_id": "gen.v1.q1.s1",
      "location": "section D",
      "observation": "Turns 1-11 argue baseline, reintroduction, patch tests and a tripwire; what the user hopes to keep and how worried they are appear only in section D's closing question and in T8's aside 'longer than you want'. C4.1 5.40, C4.4 5.60."
    },
    {
      "question_id": "q1",
      "job_id": "gen.v1.q1.s2",
      "location": "debate[8].text",
      "observation": "The user's worry surfaces only as triage ('Curiosity should not outrank a real allergic reaction'); no turn considers why three were begun at once or what the user most fears losing; section D's single question is the only reflective prompt. C4.1 4.80, C4.4 5.80."
    },
    {
      "question_id": "q2",
      "job_id": "gen.v1.q2.s1",
      "location": "debate[10].text",
      "observation": "T10 proposes one motive, relief from debt or insecurity, as the speaker's own addition; T11 recaps instead of taking it up, and the user's ranking of time, money and career is asked only in section D's ideal-Tuesday question. C4.1 7.30, C4.3 8.00."
    },
    {
      "question_id": "q2",
      "job_id": "gen.v1.q2.s2",
      "location": "debate[3].text",
      "observation": "T3 asserts 'Fear of regret shouldn't be what keeps anyone stuck' as a lecture, not a possibility to weigh; T7 names money's purpose as the only motive; no turn sets motives side by side. C4.1 5.80, C4.4 6.80."
    },
    {
      "question_id": "q3",
      "job_id": "gen.v1.q3.s1",
      "location": "section D",
      "observation": "Motives appear in sections A and D only (bothered by how it feels, or by what it says about the friend); turns 1-10 debate whether and how to speak; the fear of hearing the friend cares less is never named in a turn. C4.4 7.00."
    },
    {
      "question_id": "q3",
      "job_id": "gen.v1.q3.s2",
      "location": "debate[9].text",
      "observation": "Positive case under the same prompt: T9 sets two readings against each other (minding the imbalance versus minding not knowing you are wanted) and T10 shows each reading favours a different action while declining to guess which is the user's. C4.1 9.00, C4.5 8.70, the lineage's best on this question."
    },
    {
      "question_id": "q4",
      "job_id": "gen.v1.q4.s2",
      "location": "debate[6].text",
      "observation": "Positive case: T6 contests the Realist's reading with a rival one (not-wanting can itself be borrowed), T7 concedes naming T6 as the cause, T8 turns it into a test the user can apply. C4.1 9.30, the lineage's highest, from motive readings argued inside the turns; C4.4 still 7.80 because fear of being left out is never named."
    },
    {
      "question_id": "q5",
      "job_id": "gen.v1.q5.s1",
      "location": "section A",
      "observation": "Section A assumes 'Your goal seems to be understanding' and no turn or section offers an alternative reason for asking or what kind of answer would satisfy; C4.1 4.50, C4.3 5.00. In gen.v1.q5.s2 section E offers two aims (a simple defensible answer, or caring what could change) and C4.1 reaches 7.40, so rival readings of what the asker is after score even on a context-free exploratory question."
    }
  ],